{
    "sendingFacilityID": "FAC-ABJ-00123",
    "sendingFacilityName": "General Hospital Maitama",
    "receivingLabID": "LIMS150002",
    "receivingLabName": "National Reference Lab Abuja",
    "manifestID": "EIDMANI123",
    "dateScheduledForPickup": "2025-09-03",
    "temperatureAtPickup": 4.0,
    "samplePackagedBy": "Nurse ADAMU",
    "courierRiderName": "Rider MUSA",
    "courierContact": "08031234567",
    "sampleInformation": [
      {
        "patientID": { "idNumber": "HOSP0001001", "idTypeCode": "HOSPITALNO" },
        "sampleID": "EIDSMP00001",
        "firstName": "AMINA",
        "surName": "BELLO",
        "dateOfBirth": "2025-07-10",
        "ageInMonths": 2,
        "sex": "F",
        "sampleCollectionDate": "2025-09-01",
        "sampleCollectionTime": "2025-09-01T08:15:00Z",
        "reasonForPCR/indicationForEID": 1,
        "rapidTestDone": false,
        "artAdministeredToMother": 1,
        "babyReceived": 1,
        "babyEverBreastFed": "YES",
        "babyBreastFeedingNow": "YES",
        "ageBreastFeedingStoppedMonths": -1,
        "cotrimoxazoleGiven": "GIVEN",
        "motherANCNo": "ANC-ABJ-0001",
        "guardianPhoneNo": "08030000001",
        "motherEntryPoint": "PMTCT",
        "motherPepfarID": "PEPFAR-001",
        "sampleOrderedBy": "Dr. KOLA",
        "sampleOrderDate": "2025-08-31",
        "sampleCollectedBy": "CHEW LADI",
        "dateSampleSent": "2025-09-02"
      },
      {
        "patientID": { "idNumber": "REC0002002", "idTypeCode": "RECENCY" },
        "sampleID": "EIDSMP00002",
        "firstName": "IBRAHIM",
        "surName": "ALI",
        "dateOfBirth": "2025-02-18",
        "ageInMonths": 6,
        "sex": "M",
        "sampleCollectionDate": "2025-09-01",
        "sampleCollectionTime": "2025-09-01T08:30:00Z",
        "reasonForPCR/indicationForEID": 2,
        "rapidTestDone": false,
        "artAdministeredToMother": 2,
        "babyReceived": 1,
        "babyEverBreastFed": "YES",
        "babyBreastFeedingNow": "NO",
        "ageBreastFeedingStoppedMonths": 5,
        "cotrimoxazoleGiven": "NOT_GIVEN",
        "motherANCNo": "ANC-ABJ-0002",
        "guardianPhoneNo": "08030000002",
        "motherEntryPoint": "OPD",
        "motherPepfarID": "PEPFAR-002",
        "sampleOrderedBy": "Dr. OKON",
        "sampleOrderDate": "2025-08-31",
        "sampleCollectedBy": "Nurse ZARA",
        "dateSampleSent": "2025-09-02"
      },
      {
        "patientID": { "idNumber": "CLI0003003", "idTypeCode": "CLIENTID" },
        "sampleID": "EIDSMP00003",
        "firstName": "ZARA",
        "surName": "SANI",
        "dateOfBirth": "2025-01-25",
        "ageInMonths": 7,
        "sex": "F",
        "sampleCollectionDate": "2025-09-01",
        "sampleCollectionTime": "2025-09-01T08:45:00Z",
        "reasonForPCR/indicationForEID": 1,
        "rapidTestDone": false,
        "artAdministeredToMother": 1,
        "babyReceived": 2,
        "babyEverBreastFed": "YES",
        "babyBreastFeedingNow": "YES",
        "ageBreastFeedingStoppedMonths": -1,
        "cotrimoxazoleGiven": "GIVEN",
        "motherANCNo": "ANC-ABJ-0003",
        "guardianPhoneNo": "08030000003",
        "motherEntryPoint": "PMTCT",
        "motherPepfarID": "PEPFAR-003",
        "sampleOrderedBy": "Dr. SANI",
        "sampleOrderDate": "2025-08-31",
        "sampleCollectedBy": "CHEW IBISO",
        "dateSampleSent": "2025-09-02"
      },
      {
        "patientID": { "idNumber": "HOSP0004004", "idTypeCode": "HOSPITALNO" },
        "sampleID": "EIDSMP00004",
        "firstName": "MARYAM",
        "surName": "LAWAL",
        "dateOfBirth": "2024-12-15",
        "ageInMonths": 8,
        "sex": "F",
        "sampleCollectionDate": "2025-09-01",
        "sampleCollectionTime": "2025-09-01T09:00:00Z",
        "reasonForPCR/indicationForEID": 3,
        "rapidTestDone": false,
        "artAdministeredToMother": 2,
        "babyReceived": 2,
        "babyEverBreastFed": "YES",
        "babyBreastFeedingNow": "NO",
        "ageBreastFeedingStoppedMonths": 6,
        "cotrimoxazoleGiven": "GIVEN",
        "motherANCNo": "ANC-ABJ-0004",
        "guardianPhoneNo": "08030000004",
        "motherEntryPoint": "OPD",
        "motherPepfarID": "PEPFAR-004",
        "sampleOrderedBy": "Dr. GABRIEL",
        "sampleOrderDate": "2025-08-31",
        "sampleCollectedBy": "Nurse ADA",
        "dateSampleSent": "2025-09-02"
      },
      {
        "patientID": { "idNumber": "REC0005005", "idTypeCode": "RECENCY" },
        "sampleID": "EIDSMP00005",
        "firstName": "MUSA",
        "surName": "DANLADI",
        "dateOfBirth": "2024-10-01",
        "ageInMonths": 11,
        "sex": "M",
        "sampleCollectionDate": "2025-09-01",
        "sampleCollectionTime": "2025-09-01T09:15:00Z",
        "reasonForPCR/indicationForEID": 2,
        "rapidTestDone": true,
        "dateRapidTestDone": "2025-08-28",
        "resultOfRapidTest": "NEGATIVE",
        "artAdministeredToMother": 1,
        "babyReceived": 1,
        "babyEverBreastFed": "YES",
        "babyBreastFeedingNow": "NO",
        "ageBreastFeedingStoppedMonths": 10,
        "cotrimoxazoleGiven": "GIVEN",
        "motherANCNo": "ANC-ABJ-0005",
        "guardianPhoneNo": "08030000005",
        "motherEntryPoint": "PMTCT",
        "motherPepfarID": "PEPFAR-005",
        "sampleOrderedBy": "Dr. EFE",
        "sampleOrderDate": "2025-08-31",
        "sampleCollectedBy": "CHEW RUTH",
        "dateSampleSent": "2025-09-02"
      },
      {
        "patientID": { "idNumber": "CLI0006006", "idTypeCode": "CLIENTID" },
        "sampleID": "EIDSMP00006",
        "firstName": "AISHA",
        "surName": "YAKUBU",
        "dateOfBirth": "2024-09-20",
        "ageInMonths": 12,
        "sex": "F",
        "sampleCollectionDate": "2025-09-01",
        "sampleCollectionTime": "2025-09-01T09:30:00Z",
        "reasonForPCR/indicationForEID": 1,
        "rapidTestDone": true,
        "dateRapidTestDone": "2025-08-29",
        "resultOfRapidTest": "POSITIVE",
        "artAdministeredToMother": 2,
        "babyReceived": 1,
        "babyEverBreastFed": "YES",
        "babyBreastFeedingNow": "YES",
        "ageBreastFeedingStoppedMonths": -1,
        "cotrimoxazoleGiven": "GIVEN",
        "motherANCNo": "ANC-ABJ-0006",
        "guardianPhoneNo": "08030000006",
        "motherEntryPoint": "PMTCT",
        "motherPepfarID": "PEPFAR-006",
        "sampleOrderedBy": "Dr. SHOLA",
        "sampleOrderDate": "2025-08-31",
        "sampleCollectedBy": "Nurse KEMI",
        "dateSampleSent": "2025-09-02"
      },
      {
        "patientID": { "idNumber": "HOSP0007007", "idTypeCode": "HOSPITALNO" },
        "sampleID": "EIDSMP00007",
        "firstName": "PATIENCE",
        "surName": "OKORO",
        "dateOfBirth": "2024-08-05",
        "ageInMonths": 13,
        "sex": "F",
        "sampleCollectionDate": "2025-09-01",
        "sampleCollectionTime": "2025-09-01T09:45:00Z",
        "reasonForPCR/indicationForEID": 3,
        "rapidTestDone": true,
        "dateRapidTestDone": "2025-08-25",
        "resultOfRapidTest": "NEGATIVE",
        "artAdministeredToMother": 1,
        "babyReceived": 2,
        "babyEverBreastFed": "YES",
        "babyBreastFeedingNow": "NO",
        "ageBreastFeedingStoppedMonths": 12,
        "cotrimoxazoleGiven": "NOT_GIVEN",
        "motherANCNo": "ANC-ABJ-0007",
        "guardianPhoneNo": "08030000007",
        "motherEntryPoint": "OPD",
        "motherPepfarID": "PEPFAR-007",
        "sampleOrderedBy": "Dr. IME",
        "sampleOrderDate": "2025-08-31",
        "sampleCollectedBy": "CHEW AYO",
        "dateSampleSent": "2025-09-02"
      },
      {
        "patientID": { "idNumber": "REC0008008", "idTypeCode": "RECENCY" },
        "sampleID": "EIDSMP00008",
        "firstName": "JOSHUA",
        "surName": "EMEKA",
        "dateOfBirth": "2024-11-10",
        "ageInMonths": 9,
        "sex": "M",
        "sampleCollectionDate": "2025-09-01",
        "sampleCollectionTime": "2025-09-01T10:00:00Z",
        "reasonForPCR/indicationForEID": 2,
        "rapidTestDone": true,
        "dateRapidTestDone": "2025-08-27",
        "resultOfRapidTest": "NEGATIVE",
        "artAdministeredToMother": 1,
        "babyReceived": 1,
        "babyEverBreastFed": "YES",
        "babyBreastFeedingNow": "YES",
        "ageBreastFeedingStoppedMonths": -1,
        "cotrimoxazoleGiven": "GIVEN",
        "motherANCNo": "ANC-ABJ-0008",
        "guardianPhoneNo": "08030000008",
        "motherEntryPoint": "PMTCT",
        "motherPepfarID": "PEPFAR-008",
        "sampleOrderedBy": "Dr. RABIU",
        "sampleOrderDate": "2025-08-31",
        "sampleCollectedBy": "Nurse FATI",
        "dateSampleSent": "2025-09-02"
      },
      {
        "patientID": { "idNumber": "CLI0009009", "idTypeCode": "CLIENTID" },
        "sampleID": "EIDSMP00009",
        "firstName": "HALIMA",
        "surName": "GARBA",
        "dateOfBirth": "2025-04-12",
        "ageInMonths": 4,
        "sex": "F",
        "sampleCollectionDate": "2025-09-01",
        "sampleCollectionTime": "2025-09-01T10:15:00Z",
        "reasonForPCR/indicationForEID": 1,
        "rapidTestDone": false,
        "artAdministeredToMother": 2,
        "babyReceived": 1,
        "babyEverBreastFed": "YES",
        "babyBreastFeedingNow": "NO",
        "ageBreastFeedingStoppedMonths": 3,
        "cotrimoxazoleGiven": "GIVEN",
        "motherANCNo": "ANC-ABJ-0009",
        "guardianPhoneNo": "08030000009",
        "motherEntryPoint": "PMTCT",
        "motherPepfarID": "PEPFAR-009",
        "sampleOrderedBy": "Dr. MOSES",
        "sampleOrderDate": "2025-08-31",
        "sampleCollectedBy": "CHEW LUKMAN",
        "dateSampleSent": "2025-09-02"
      },
      {
        "patientID": { "idNumber": "HOSP0010010", "idTypeCode": "HOSPITALNO" },
        "sampleID": "EIDSMP00010",
        "firstName": "SANI",
        "surName": "UMAR",
        "dateOfBirth": "2024-11-28",
        "ageInMonths": 9,
        "sex": "M",